<?xml version="1.0" encoding="UTF-8"?>
<xs:schema xmlns:xs="http://www.w3.org/2001/XMLSchema">
    <xs:element name="generadorcv">
        <xs:complexType>
            <xs:sequence>
                <xs:element name="usuariado">
                    <xs:complexType>
                        <xs:sequence>
                            <xs:element name="cuenta" maxOccurs="unbounded">
                                <xs:complexType>
                                    <xs:sequence>
                                        <xs:element name="nombre" type="xs:string"/>
                                        <xs:element name="apellidos" type="xs:string"/>
                                        <xs:element name="mail" type="xs:string"/>
                                        <xs:element name="user" type="xs:string"/>
                                        <xs:element name="pass" type="xs:string"/>
                                    </xs:sequence>
                                    <xs:attribute name="id" type="xs:integer" use="required"/>
                                </xs:complexType>
                            </xs:element>
                        </xs:sequence>
                    </xs:complexType>
                </xs:element>
                <xs:element name="curriculums">
                    <xs:complexType>
                        <xs:sequence>
                            <xs:element name="CV" maxOccurs="unbounded">
                                <xs:complexType>
                                    <xs:sequence>
                                        <xs:element name="titulo" type="xs:string"/>
                                        <xs:element name="formacion">
                                            <xs:complexType>
                                                <xs:sequence>
                                                    <xs:element name="titulacion" maxOccurs="unbounded">
                                                        <xs:complexType>
                                                            <xs:sequence>
                                                                <xs:element name="nombre" type="xs:string"/>
                                                                <xs:element name="fecha" type="xs:date"/>
                                                                <xs:element name="centro" type="xs:string"/>
                                                            </xs:sequence>
                                                        </xs:complexType>
                                                    </xs:element>
                                                    <xs:element name="idioma" maxOccurs="unbounded">
                                                        <xs:complexType>
                                                            <xs:sequence>
                                                                <xs:element name="nombre" type="xs:string"/>
                                                                <xs:element name="nivel" type="xs:string"/>
                                                                <xs:element name="certificado" type="xs:string"/>
                                                            </xs:sequence>
                                                        </xs:complexType>
                                                    </xs:element>
                                                </xs:sequence>
                                            </xs:complexType>
                                        </xs:element>
                                        <xs:element name="experiencia">
                                            <xs:complexType>
                                                <xs:sequence>
                                                    <xs:element name="item" maxOccurs="unbounded">
                                                        <xs:complexType>
                                                            <xs:sequence>
                                                                <xs:element name="titulo" type="xs:string"/>
                                                                <xs:element name="categoria" type="xs:string"/>
                                                                <xs:element name="descripcion" type="xs:string"/>
                                                                <xs:element name="fecha_inicio" type="xs:date"/>
                                                                <xs:element name="fecha_fin" type="xs:date"/>
                                                            </xs:sequence>
                                                        </xs:complexType>
                                                    </xs:element>
                                                </xs:sequence>
                                            </xs:complexType>
                                        </xs:element>
                                    </xs:sequence>
                                    <xs:attribute name="cuenta" type="xs:integer" use="required"/>
                                    <xs:attribute name="id" type="xs:integer" use="required"/>
                                </xs:complexType>
                            </xs:element>
                        </xs:sequence>
                    </xs:complexType>
                </xs:element>
            </xs:sequence>
        </xs:complexType>
    </xs:element>
</xs:schema>