<?xml version="1.0" encoding="UTF-8"?>
<generadorcv xmlns:xsi="http://www.w3.org/2001/XMLSchema-instance" xsi:noNamespaceSchemaLocation="datos.xsd">
    <usuariado>
        <cuenta id="0">
            <nombre>Administración</nombre>
            <apellidos>verepass</apellidos>
            <mail>admin@verepass.com</mail>
            <user>root</user>
            <pass>123456</pass>
        </cuenta>
        <cuenta id="1">
            <nombre>Ana</nombre>
            <apellidos>Simón Simón</apellidos>
            <mail>anass@gmail.com</mail>
            <user>anass</user>
            <pass>123456</pass>
        </cuenta>
    </usuariado>
    <curriculums>
        <CV cuenta="1" id="0">
            <titulo>CV Ana Simón</titulo>
            <formacion>
                <titulacion>
                    <nombre>Carrera de derecho</nombre>
                    <fecha>2018-06-28</fecha>
                    <centro>Universidad Publica de Zaragoza</centro>
                </titulacion>
                <idioma>
                    <nombre>Español</nombre>
                    <nivel>Materno</nivel>
                    <certificado></certificado>
                </idioma>
            </formacion>
            <experiencia>
                <item>
                    <titulo>Auxiliar de secretario judicial - Aboga2</titulo>
                    <categoria>Prácticas</categoria>
                    <descripcion>Contrato de prácticas como ayundante de secretario judicial en Aboga2.</descripcion>
                    <fecha_inicio>2018-09-06</fecha_inicio>
                    <fecha_fin>2020-11-14</fecha_fin>
                </item>
            </experiencia>
        </CV>
    </curriculums>
</generadorcv>